,text
2145,.@Lagarde shares a new study showing that gender diversity in the workforce benefits us all: https://t.co/2EK3WkDt0z https://t.co/1W2lO8UE91
2146,RT @Lagarde: Honored to have @MelindaGates at the #AdvancingAsia conference.  Empowering women is essential for Asia’s growth. https://t.co…
2147,The combined value of women's unpaid work is nearly equal to China's GDP: https://t.co/8ryWS8nomg @FT https://t.co/Fqh5IqHcn9
2148,"I’m in New Delhi with @BDUTT, Suneeta Dhar &amp; @kalkikanmani talking about progress India has seen for women &amp; girls. https://t.co/EUOzYrt6T3"
2149,Join Bill &amp; me in making every day the #BestSchoolDay for students &amp; support @DonorsChoose. https://t.co/9eaxgrfoCl https://t.co/e8bK8jBwQb
2150,.@AdrienneLaF analyzed her own reporting for gender bias and got some important results: https://t.co/wOe4TynHuK https://t.co/fVcQOifjCn
2151,There's been great progress for women around the world. Which #ceilingbreakers moment inspires you? https://t.co/lDPbeoUWQc #IWD2016
2152,"An inspiring letter on #IWD2016 from @JustinTrudeau: ""Equality is not a threat, it is an opportunity.""
https://t.co/FaX8vZhoNX"
2153,Proud to join @ONECampaign's call to world leaders to end poverty by investing in women &amp; girls: https://t.co/iqCY11Cp1p #PovertyIsSexist
2154,Join @dosomething and shine a light on a superhero in your community: https://t.co/GWiAG3pzhU #superpowerforgood https://t.co/w7nGJR8a11
2155,The goal: giving women more time. @Flocabulary raps about time poverty. https://t.co/RQhBdUZ21a
2156,"When both men &amp; women are encouraged to take parental leave, it's good for families &amp; businesses: https://t.co/uhTzjDUBkV via @TheEconomist"
2157,"Electricity can change lives, lift economies, and brighten the world’s future: https://t.co/zaGo0z6g4o
https://t.co/I7pAQlROZI"
2158,"The stigma surrounding periods is so bad, it’s keeping women away from school and work: https://t.co/Js5pQcfcZY via @mashable"
2159,Men's time should = women's time. It's that simple. https://t.co/ZN6HWNuv2p
2160,#TBT to our Tanzania trip. The woman next to me got me thinking about time as a resource: https://t.co/1biABTeMsQ https://t.co/MLv7FK44Ms
2161,Eva would use her #superpowerforgood to spend less time doing chores &amp; more time in school: https://t.co/JUP3IDRoXx https://t.co/9LYzG0S8BC
2162,The goal: giving women more time. @Flocabulary raps about time poverty. https://t.co/sWZe86Sv9M
2163,Everyone benefits when women have the opportunity to participate in the labor force. https://t.co/1E01jxNu82 https://t.co/TPG3FZVyOv
2164,Proud to support @eddieizzard as he runs 27 marathons in 27 days for #sportrelief. Go Eddie! #marathonman https://t.co/AmQaAUE6Ce
2165,Watch @BrookAndBailey explain how they would use their superpower to give back to the world: https://t.co/EwDHw2biGQ
2166,"Here are three things you can do to reduce a gender gap that’s holding the world back: https://t.co/IttqRp44V5
https://t.co/93bL17xVkf"
2167,"Time is just as much a resource as wood and nails, and women everywhere have less of it: https://t.co/AzzucGEmQw https://t.co/0kSKIgdoqT"
2168,"The goal is to give women more time. Listen to @Flocabulary rap about time poverty: https://t.co/p2EPjNQrTb
https://t.co/YDg5VFI1B7"
2169,@jnovogratz Absolutely-- time and energy could change the world.
2170,@PaulPolman Thanks for your support!
2171,"@Benioff Thanks for sharing! As you know, men play a critical role in the gender equality conversation."
2172,"Time &amp; energy are two resources needed to break the cycle of poverty. @HansRosling explains.
https://t.co/QGcw7EWNbT"
2173,"In some countries, the average woman spends 8 hours on housework, every single day: https://t.co/WmOk5rhs9C https://t.co/aLFyI7pgCU"
2174,"#LeapDay is fun, but imagine what would be possible if you had extra hours EVERY day? https://t.co/7nFyv2IDXN https://t.co/KqKaXYi1Xv"
2175,"When the responsibility of managing a household falls to women, the consequences are huge: https://t.co/VxqVk3GXgi https://t.co/dOi3Ou8pSz"
2176,"On a trip to Tanzania, I saw how not having enough time affects women like Anna.
https://t.co/Ttgz4VBDvn"
2177,"In the time the average woman spends on 16 months of housework, she could learn Chinese: https://t.co/rJRXdUEtGj https://t.co/XLPjrsbbb3"
2178,"Unless things change, girls will spend tens of thousands more hours than boys on housework: https://t.co/aN5mtWvr7S https://t.co/sHj6vVh1ma"
2179,"Triangle kitchens made housework more efficient, but not necessarily more equitable: https://t.co/IjP6Wc7zz1 https://t.co/cIoZa62gva"
2180,"What if I told you that from now on, your days would only be twenty hours long? https://t.co/dlK4Zv11Ag https://t.co/f1FRX4IZu3"
2181,"In lower-income countries, household work takes longer: https://t.co/m9i3xITqJN https://t.co/fWUWcM2zit"
2182,"When men and women challenge the assumption that household chores are women’s work, everyone benefits: https://t.co/WiBupyDfFx #ShareTheLoad"
2183,Many women can’t join the workforce because their time is filled with work at home. https://t.co/U3cOwyqkYV https://t.co/z823nhfHxg
2184,"The rise of the stove helped make dinner faster. But it didn’t change who does the cooking: https://t.co/ReaBJOspqn
https://t.co/AblTwcw0yz"
2185,@CherieBlairFndn Thanks for all you do to elevate women.
2186,Thanks for using your voice to advocate for women and girls. https://t.co/Hgxg86YHBf
2187,"Take this quiz about time, energy, and superheroes to see what your superpower IQ is: https://t.co/FF0yWFaEnZ https://t.co/2qh5YoRnss"
2188,#WhenIWas15 I split my free time between drill team and learning to code. https://t.co/Ydfb1jpoxd #TBT https://t.co/0yjqYMobU4
2189,"In India, women spend about 6 hours on unpaid work around the house. Men spend less than 1: https://t.co/YD71glJiqX https://t.co/lKvcGFyaOn"
2190,"RT @clairecm: Indian women spend 6.6x as much time as men on unpaid work. American women spend 1.5x as much time as men. 
https://t.co/yMS4…"
2191,We know having more time and energy could change our lives. It could also change the world: https://t.co/oyopX8f4Je https://t.co/I5WNCZck4y
2192,"We don’t always think of it as one, but time is an important resource: 
https://t.co/bkVOKLt5Op
https://t.co/Un2zYZ6xt9"
2193,I’m catching up with @RobinRoberts on the set of @GMA. Join the conversation at 8:35 AM. https://t.co/ri8MYKq5n3
2194,This meme makes me laugh. It also makes me impatient: https://t.co/6cVZygsQvV https://t.co/Uw7mWNrPKR
2195,Enjoyed talking with @jimmyfallon about our Annual Letter—and his #superpowerforgood: https://t.co/hc2GtreX7C https://t.co/d1wjBLcGTR
2196,Bill and I are hosting a dance party on @FallonTonight. Tune in at 11:35PM EST. #FallonTonight #superpowerforgood https://t.co/AxX40mYRGc
2197,Ever wanted to change the world? Bill and I need your help: https://t.co/vwODnjm5pw https://t.co/lQlVp9UZg1
2198,My #superpowerforgood would be more time. What’s yours? https://t.co/kgzT0e9yt6 https://t.co/jckOPl6Rbe
2199,Bill &amp; I enjoyed talking to these incredible young people about their #superpowerforgood: https://t.co/edQffcH9JQ https://t.co/KHHDdh5QlD
2200,It's crazy that women do 2X the unpaid work of men. Join the discussion: https://t.co/edQffcH9JQ #superpowerforgood https://t.co/cBzFbXpNr4
2201,We're LIVE. Bill and I talk to @johngreen about our #superpowerforgood. Watch here: https://t.co/edQffcH9JQ https://t.co/au5wzsVzSR
2202,RT @MalalaFund: Malala's #SuperpowerForGood? To speak in a voice so loud the world will listen. What's yours? @gatesfoundation https://t.co…
2203,Great talk w/ @SRuhle and John Micklethwait @business about why the world is getting better: https://t.co/yw8moeDIyt https://t.co/OsAR9gGTAT
2204,RT @marieclaire: Join us for a Facebook livestream with @melindagates today at 10:45 a.m. EST! https://t.co/1NS4FXp74L
2205,Bill and I are sharing our Annual Letter. We believe young people will change the world: https://t.co/XgHOykUdl1 https://t.co/NSUdcaddLZ
2206,"RT @BillGates: Join Melinda and me tomorrow at 1pm Eastern for a live Q&amp;A hosted by John Green: https://t.co/UKw4saWWaz
https://t.co/Iu0Cmu…"
2207,Fascinating look at what new mothers around the world bring to the hospital: https://t.co/bzMQJoR9zz @TheAtlantic https://t.co/FmqfJLhZcT
2208,This interview tells you everything you need to know about why the incredible @csantor16 is AASA Woman of the Year: https://t.co/L5BxhsDzwg
2209,A powerful reminder from @Pontifex that serving God begins with serving others: https://t.co/V2skTqqaTU https://t.co/D1arUJKZsX
2210,New study finds having women in corporate leadership translates to a 15% increase in profitability: https://t.co/RRramVj7El via @HarvardBiz
2211,What does breaking a glass ceiling look like? It looks like these women: https://t.co/6qinGNYluC @broadly https://t.co/2KkAdSiQkL
2212,The @GatesFoundation is starting a new initiative for US families. @SueDHellmann explains: https://t.co/zQo3I8peRl https://t.co/Uz51B5sYLA
2213,"RT @papermagazine: ""[They] helped me imagine what was possible for myself."" @MelindaGates on 'Girl Crushes' https://t.co/ehx26UU27O https:/…"
2214,"Young people are ""pushing the rest of us toward change."" Great piece from @BarackObama: https://t.co/pNWblslGwy via @lifemotto"
2215,"As housework becomes more equitably distributed, the market is responding: https://t.co/44COe06tMb via @WSJ https://t.co/KzI6l9JFiN"
2216,How do we get contraception to women in rural areas? Maybe delivery drones: https://t.co/yBlqGj2ecp @WomenintheWorld https://t.co/Na95B3ujer
2217,"In developing countries, there’s a gender gap in internet access: via @qz https://t.co/OgCzTTiz9A"
2218,1 in 5 people in Africa have internet access. Getting more people connected could lift millions out of poverty: https://t.co/yAC8yXpHwM @BV
2219,Thrilled to see young philanthropists like @CariTuna and @moskov taking a data-driven approach to global health: https://t.co/yz55STklPY
2220,.@CTurlington is making childbirth safer for women &amp; babies. Such important work: https://t.co/EWDuJ1SkN7 @WSJMag https://t.co/5I3kUeNCJ8
2221,"I’ve heard these six myths about women in the workplace all my life, and none of them have ever proven true: https://t.co/eLyoj2UfPp"
2222,Barbara Bush &amp; @fleetwoodjmack share great advice for young global health advocates: https://t.co/W2SM81Nmor https://t.co/mxsxKjbrex
2223,Science—not fear—must guide our response to #zikavirus: https://t.co/AE0N4G7IOp via @gatesfoundation @TIME
2224,It's time to dispel the myth that women’s time and work is inherently less valuable than men's: https://t.co/j4R1mR6Krf via @qz
2225,Never before have we seen this kind of momentum for women and girls: https://t.co/iMQFkUTs5C via @marieclaire https://t.co/62prALiO6p
2226,"RT @marieclaire: Meet https://t.co/kY1KgKghZF's new contributing editor, @MelindaGates: https://t.co/KJAZSPt5E1 https://t.co/L6ULpB0qQk"
2227,"In the @USC video game design program, there are now more women than men: https://t.co/jd2dZPFAt8 via @LATimes https://t.co/K1NwCWGF01"
2228,"If women were paid market value for the work they do around the house, their incomes would almost equal China's GDP: https://t.co/4FMwx5I2dR"
2229,What's America's greatest innovation? I make the case for mobile phones. Hear why &amp; cast your vote @TheTakeaway: https://t.co/XJ1zjERtyd
2230,The stories we read to our kids shape the way they see the world and their role in it: https://t.co/yGRvKPG97L https://t.co/rxN2KijMkW
2231,Only 22% of students taking the computer science AP exam are girls. It's time for change. This initiative will help: https://t.co/I4GVabBxLM
2232,Women shouldn't be in the dark about whether they're receiving equal pay. Better data helps stop discrimination: https://t.co/tVzR8Si4Bg
2233,How do we get lifesaving #familyplanning tools to more women? Here are 5 ideas: https://t.co/tNqBZOBhn5 #ICFP https://t.co/PSHqp02y64
2234,7 benefits of family planning that have nothing to do with sex: https://t.co/hsLZzcQm0i https://t.co/pdOebdkLoN
2235,Women everywhere spend more time on unpaid labor than men. What would they do if they could get those hours back? https://t.co/pY6jvygdZL
2236,4 years ago we committed to giving 120M more women access to contraceptives. Let's finish what we started: https://t.co/AYU1mXGnSN #ICFP2016
2237,Can #familyplanning change the course of a woman's life? Ask Manju and Sushma: https://t.co/mXfWlO8Wo0 #ICFP2016
2238,"For me, it was my dad. For my daughters, it’s Bill. Fathers play a crucial role in getting girls involved in science https://t.co/y00lDSpSX7"
2239,Giving life should never mean losing yours. More moms survive when they have access to #familyplanning. #ICFP2016 https://t.co/TcUUohXBKM
2240,"This week, let's get closer to a world where every woman has the power to decide her own future. #ICFP2016 https://t.co/kz2H4PXRaW"
2241,I loved spending time with @GlobalShapers in #Davos. They are already having big impacts early in their careers. https://t.co/mxzGs56oCO
2242,Inspired by these women working toward gender equality. @hannahgodefa @JustineGreening @almmura #davos https://t.co/d29xcmqLLc
2243,“Men have to be part of this conversation.” - @JustinTrudeau on #genderequality https://t.co/dkhYsUtPxJ https://t.co/cwmcAyfISX
2244,"Photographer Steve McCurry masterfully captures India's ""extraordinary contradictions"" https://t.co/ukJPSAR9vf @BBC https://t.co/g7e2IBHrmw"
2245,Eliminating poverty must remain at the top of the global agenda. 3 things that will help get us there: https://t.co/GEpquiMMOI #Davos #WEF
2246,@Anne_Hidalgo It was wonderful to see you again in #Paris. I'm inspired by your commitment to government innovation. Merci!
2247,@TinaBrownLM Thank you for hosting this evening. It is an honor to be recognized alongside Obiageli Ezekwesili.
2248,"To help break the cycle of poverty, give a woman a cell phone: https://t.co/czxxVYbZPQ via @dealbook https://t.co/MhUQKk9R3v"
2249,One of these women might be the first person on Mars: https://t.co/fOqej1XPXd via @glamourmag https://t.co/OwcPEtKLbl
2250,There are 2.6 million stillbirths each year. Most of them are preventable. Together we can #endstillbirths: https://t.co/aNG88Qv4dU
2251,"It was great to spend time w/@MaitenaBiraben at @GrdJournal in Paris. Merci, Maitena. https://t.co/MAjwARLlUI #LGJ https://t.co/QNmOiaoqty"
2252,"If women could spend more time doing things they love and less time doing chores, how many lives would they change? https://t.co/Ke4RIloOIl"
2253,Remarkable progress in Nepal--maternal mortality is down 75% since 1990: https://t.co/G21V4f8AAk via @dev_progress https://t.co/THSyYGSBBM
2254,"After learning about the Ebola outbreak, 17-year-old Olivia Hallisey was inspired to help: https://t.co/QMh0rQxLZo via @colbertlateshow"
2255,The incredible Dr. Mkopi talks parenthood and diarrhea in this great interview: https://t.co/VFeHDJVp7H via @NPR
2256,"Who does a family's laundry? Almost everywhere, it's the mom. What would she do if she could get those hours back? https://t.co/B6Xt7ckAhB"
2257,"If you liked @amyjccuddy's TED talk on power poses, you should check out her latest project: https://t.co/h652I1fYpX https://t.co/lP07Ibes4H"
2258,.@marktuschman is using art to highlight the everyday courage of women around the world: https://t.co/vlqFdPEmBY https://t.co/sZdrM73wM6
2259,"Ricky Thacker’s math class was one of the most memorable Bill &amp; I have ever seen: https://t.co/cgNdft81cP
https://t.co/A4l4zmtW21"
2260,"Meet Kane, who told me over pizza that AP Geography taught him to believe in himself: https://t.co/QUdOfJRHX6 https://t.co/dKl8kuGefq"
2261,"Easily my favorite interview Bill and I did all year: https://t.co/ELmRhVPgG4
https://t.co/WfmgEXIplt"
2262,Every student in the country deserves to go to a school like this one: https://t.co/2Y9N0OHt66 https://t.co/QBY4mtNLa5
2263,"Powerful mantra used by @AmbassadorPower: ""Never compare your insides to somebody else’s outsides."" https://t.co/A4PVrEpEvc"
2264,Great Q&amp;A with Bill Gates Sr. on raising Bill and a life-changing conversation we had while in line for the movies: https://t.co/jqeX7umxKp
2265,What was your most memorable New Year's resolution? Mine was deciding to be less afraid: https://t.co/Kv0sToezSm
2266,Here's how I'd like to remember 2015: a year of exceptional moments for women: https://t.co/JiiS9jP9x9 @MAKERSwomen https://t.co/r7y3j1ixXa
2267,One of the highlights of my year--meeting these incredible women in Malawi: https://t.co/jyz7CuLPJW via @marieclaire https://t.co/bO54k7s3LT
2268,A bindi that delivers nutrients &amp; 25 other innovations that are changing the world https://t.co/w34DIFZHQA @mashable https://t.co/rq8A6t7OBr
2269,Great holiday read: @NPR on the relationships we have with our adult siblings and the role of evolutionary biology: https://t.co/saeIVet9hT
2270,Had a great time talking philanthropy with @NickKristof @WuDunn @NinaEaston at the @Smithsonian earlier this month: https://t.co/4iRsujpFXw
2271,Not convinced that #vaccineswork? Take a look at this map: https://t.co/3AAXKijHyd https://t.co/oUofpxXsWY
2272,Reflecting on the stories that inspired our work at the @gatesfoundation this year: https://t.co/WkARncgPJs https://t.co/EFI47Z0wh1
2273,"Bill and I are both bookworms. Here are some of his favorite reads from 2015.
https://t.co/GFy4ohO4vc"
2274,A new @UN report says women take on 3 of every 4 hours of unpaid labor. Why that matters: https://t.co/iP1izYE1BU via @TheAtlantic
2275,This photographer captures the beauty and complexity of the first days of motherhood: https://t.co/PDCT8aGuOb https://t.co/HI1JibVZKu
2276,Impressed by Abby Wambach on &amp; off the field. Good luck tonight! https://t.co/y3gikrAvUO @FortuneMagazine @ussoccer https://t.co/QzNQPFiFKe
2277,"Companies w/strong female board members saw 36% greater return on equity: 
https://t.co/CO6VinNHLW @FortuneMagazine https://t.co/cEhu4g0WGX"
2278,"From Seattle to Senegal, cell phones are critical business tools: https://t.co/uHrr9gDeUs via @GoatsAndSoda https://t.co/txwAWzp855"
2279,Congrats to my friend @CTurlington and @everymomcounts on the launch of #GivingBirthInAmerica. Watch it here: https://t.co/8jO7MzS8il
2280,"While the boys in Prune, India fly kites, the girls do all the work at home. So the boys are making a change: https://t.co/Q8ZzM9mW0f @NPR"
2281,"Our family loved ""Inside Out."" I wish I'd had these fun tutorials when I was learning to code in high school. https://t.co/vsuprBeWp6"
2282,"To get to school, some girls in Malawi walk 10 miles. What if they had bikes? https://t.co/NAOKP69jRB @LaurenBohn https://t.co/dRgbplTL3u"
2283,Great to see more love for the Dash robot. Excellent #STEM gift suggestions via @FatherlyHQ: https://t.co/Hv3l2SNfLe https://t.co/dGrwArrhy5
2284,"Thanks, @PeytonList. With young and powerful women like you speaking out, I can’t wait to see what we achieve."
2285,".@karliekloss on fashion, learning to code, and having an impact:
https://t.co/qxHH8du8Dr via @WSJ https://t.co/jnshu2DVTR"
2286,.@THR Thank you for having me! The way we view women on screen changes how we view women in our lives. https://t.co/L72FhrQ6HE
2287,Angela Merkel put women and girls on the global agenda. Now she's the #TIMEPOY: https://t.co/0EyVPQm28m via @TIME
2288,Excited to speak at the #THRWomen in Entertainment breakfast today and celebrate some of the most trailblazing women in the industry. @THR
2289,Honored to be featured in @PORTERmagazine with @EmWatson and so many other women I admire. https://t.co/1gj5tnCc24
2290,These #STEM presents for young scientists are gifts that keep on giving: https://t.co/ULFRDKrGZ8 https://t.co/RBRGd4GhIO
2291,Looking for a way to give back when buying holiday gifts? Some of my favorites: https://t.co/PJgpTSuXox via @people https://t.co/MySTfOImER
2292,Love this @goldieblox video celebrating trailblazing women. #ShesWorthIt https://t.co/5UFsPThMFH
2293,"The incredible story of Matlab, Bangladesh: https://t.co/NTlt2E9SOi @nytimesfixes https://t.co/yKPbvme5hB"
2294,"Of all the things there’s an app for, this one’s important: making childbirth safer in Ethiopia: https://t.co/6NKZsaMhnc @qz"
2295,Support @RED today and get the chance to ride a bike with my friend Bono. https://t.co/arRcR4qIvK #WorldAIDSDay https://t.co/J7r8rZTruY
2296,Perfect way to spend #GivingTuesday-- talking philanthropy w/ @NickKristof @WuDunn &amp; @NinaEaston at @amhistorymuseum https://t.co/l7SVxaiNsW
2297,Happy #GivingTuesday! Share this video &amp; @RED will provide 10 days of life-saving HIV treatment. #WorldAIDSDay https://t.co/7tg2ZQ6MiE
2298,Big news: Bill is partnering with govts. and private investors to make a historic investment in clean energy #COP21 https://t.co/kNhYs2k3aE
2299,Bill &amp; I work hard to teach our kids gratitude. @NYTMotherlode suggests sharing family stories of receiving help: https://t.co/IwG8aHqdlZ
2300,What’s the most valuable necklace in the world? One that saves lives: https://t.co/56EJGZiQB2 @UNICEF @NPR
2301,Thanks @feministabulous for busting vaccine myths with your sharp sense of humor: https://t.co/PZIAPceiSA
2302,"When I was in high school, my father brought home a gift that changed my life: a computer: https://t.co/7N1Y4F8kTc https://t.co/uEIwq3c0uO"
2303,"Let's unlock the potential of half the population. Learn more @MAKERSwomen: https://t.co/aXmvVVR7JT
#OnceAndForAll https://t.co/mVlLJ8cDbJ"
2304,".@CarolineLHoward, thank you for turning our great conversation into this thoughtful piece. https://t.co/ck7EW7hkdl"
2305,Digital technology can transform women's lives. @WorldPulse looks at how to get them access: https://t.co/63fLVxTvuk https://t.co/1iLmhBP2un
2306,Proud to be there today! No one deserves this more @TriciaRaikes &amp; @jeffraikes. Thanks for all you do to give back. https://t.co/CruxumrqKm
2307,"Every time we innovate with women’s lives in mind, we get a little closer to equality: https://t.co/SnjrEV1zuH https://t.co/TSoBgYW1ai"
2308,"Good reminder from @SueDHellmann that individuals not only can make a difference – they already do, on a huge scale: https://t.co/UbxmVxZCBT"
2309,This new vaccine could wipe a disease off the map: https://t.co/7017Fdbpe1 #vaccineswork @nprGlobalHealth https://t.co/FJxUYVo0DZ
2310,"RT @SueDHellmann: A flock of ducks. A solar lamp. A ""hero rat"". Holiday gift ideas that give back to the world: https://t.co/2Yz1IOYf4C via…"
2311,"""Women have learned to become more like men. Now men need to learn to become more like women:"" https://t.co/3l9ggnBIml via @nytopinion"
2312,Manju &amp; Sushma grew up 20 miles away from each other in rural India. But their lives are worlds apart. Why is that? https://t.co/4bn37FFJJj
2313,"For me, learning to code was like gaining a superpower. Love the action figure, @goldieblox: https://t.co/Uvj05vJMF1 https://t.co/Bvxy4GxHI7"
2314,"This entrepreneur is tackling malnutrition with local, affordable baby food: https://t.co/8PyjNnm34F @BBCAfrica https://t.co/33RaMiwa1B"
2315,"For many women, a mobile phone can be a stepping stone out of poverty: https://t.co/F4Zm3C5IKQ via @CGAP https://t.co/C5vb6ixmJU"
2316,"If women caring for their families constituted a nation, its GDP would be equal to China's: https://t.co/hPRCoSVkxz https://t.co/rRpj9wxUn8"
2317,".@EmWatson &amp; Malala: Thank you for using your voices to speak up for women and girls everywhere. 
https://t.co/cWRyq9F8Et"
2318,Inspired by young women like Mary Mwangi – championing access to #familyplanning in Kenya: https://t.co/XEryd08mbC via @guardian
2319,No volcano can interrupt the conversation on #familyplanning. 120 million women &amp; girls are relying on us: https://t.co/3pi7igpkMu #ICFP2015
2320,What can @nancylublin do with 6.5 million text messages? Save the lives of teens in crisis: https://t.co/bMVVkQAURg https://t.co/RKHxmZLtvM
2321,"My daughter is 13. If she were born in Nimmu's village, she could be someone's wife: https://t.co/yNg11yAQ6c https://t.co/OPNncRAlx2"
2322,"Serviam—“I will serve.” It was my high school's motto, and it’s where #MyGivingStory began. What’s yours? https://t.co/AYSbG3wStA"
2323,Geena Davis on why we need action--not just talk--on gender equity in Hollywood: https://t.co/VfDZA9IfqM @GDIGM https://t.co/uvGvN6yOqt
2324,.@BabatundeUNFPA knows moms are a good investment. Maternal health yields a 3X ROI: https://t.co/PYqgzFP6M3 via @HuffingtonPost
2325,"Behind Apollo 11's ""giant leap for mankind"" was a woman named Margaret Hamilton: https://t.co/5Te9Fi3cZ0 @WIRED https://t.co/WErDSsFImO"
2326,"In Tanzania, 90% of kids don't have birth certificates. Cell phones are changing that: https://t.co/KUmXeSyYe3 https://t.co/I8Slvb8FS9"
2327,.@SusanWojcicki makes a smart case for why the underrepresentation of women in tech “should be a Sputnik moment”: https://t.co/QA7SCO9TKk
2328,Join the fight against polio. Gates Foundation will triple your donation to Rotary today: https://t.co/FiCk2AZj1M https://t.co/VdpnYHqkhd
2329,"10 million children are alive and walking today thanks to polio fighters around the world: https://t.co/gI11h6lwqe
https://t.co/Qem0udv1y7"
2330,"Thanks to health workers like Joy and Mahesh, polio cases have dropped 99% since 1988: https://t.co/QUamFriALa https://t.co/0WRBjseOJv"
2331,"The fascinating theory behind why ""mom"" and ""dad"" sound similar in so many languages: https://t.co/7lL6GzyyUU https://t.co/Ye4zbzPnkA"
2332,Being born in a car in the U.S. is still safer than being born in 21 other countries: https://t.co/bhItiV6MZm https://t.co/avh8HQQVRT
2333,"By 2030, we could save 3.3 million women by investing more in maternal health: https://t.co/AG5FQqb5gU https://t.co/S9pVLD9eK0"
