,text
1174,RT @DFID_UK: One year ago we held a global summit on family planning to bring the choice of contraception to millions more women worldwide.…
1175,"Let’s focus on making sure parents have the information, time, and support they need to best care for their babies. https://t.co/4TWSWgvB9r"
1176,"Yes, for some moms, breastfeeding can be difficult or even impossible. But for those who can breastfeed, there is no question that it’s the healthiest choice. If everyone who could breastfeed did, it would prevent the deaths of 820,000 children each year."
1177,I know breastfeeding has been in the news a lot this week. As someone who’s been working in global health for two decades—and who breastfed three kids myself—there are a few things I think bear repeating. https://t.co/nQE0SJjqLt
1178,There are more than a billion women who don’t have access to a bank account. Here’s why that needs to change. https://t.co/wbyB3ReN3q
1179,"For nearly 30 years, women in Saudi Arabia got behind the wheel to protest an injustice. Now they’re doing it to earn an income—and take charge of their futures. https://t.co/dWbjyTwSoA"
1180,".@jacindaardern launched a new #paidleave program for New Zealand—while on leave caring for her own newborn. This is what leadership looks like. 
https://t.co/L0gVB7MdVm"
1181,"Valuable advice about raising our sons to be respectful, empathetic men. 👏https://t.co/5oiqJnRTFr"
1182,"In every country on Earth, women do more cooking, more caregiving, and more unpaid household labor than men. But programs like MenCare are working to change that—and the results are remarkable. https://t.co/aNxiknyewc"
1183,"When it feels like the world is getting worse, remember that the data tells us a different story. These three stats from @MaxCRoser offer powerful evidence of progress. https://t.co/tjGMuSnvH4"
1184,"Congratulations, Massachusetts! By working across the aisle and bringing employee and business groups to the table, lawmakers were able to come together to pass a strong #paidleave policy that will help families across the state. https://t.co/g2DQqE670Y"
1185,"By raising their voices and speaking out, these brave women and men made it easier for others to do the same. In their own words, this is how joining the #MeToo movement has changed their lives. https://t.co/bK6ngtVKWH"
1186,Stephanie learned to code when she was in junior high. Then she tried a summer program at @AI4Allorg. Now she’s using artificial intelligence to make her community a better place—and working to ensure other young women have the same opportunity. https://t.co/gCpqkU1pil
1187,Dads deserve the opportunity to be equal caregivers for their kids. Paid paternity leave can go a long way toward making that happen—and I’m glad to see leaders like @alexisohanian working to make sure more Americans have access to it. https://t.co/F4bZtHBMy6
1188,"The commencement speeches I heard this year were some of the most beautiful, stirring talks that I can remember. From @SterlingKBrown, @AbbyWambach and @Atul_Gawande, here are some of my favorites. #WeekendRead https://t.co/eaAaYOtZfA"
1189,"My heart broke reading this story by @Nataliekitro &amp; @jbsgreenberg. The bias and discrimination these women have experienced is unconscionable. And it’s up to all of us to say it’s unacceptable.
https://t.co/2wtF5I2L1H"
1190,"Thanks to contraceptives, Elizabeth was able to finish school, pursue a career she loves, and provide for her family. Every woman around the world deserves that same chance. https://t.co/VbxOEnfShP"
1191,We all know he’s pretty nerdy. But here’s something you might not know about @BillGates: he’s also absolutely hilarious. Happy #FathersDay to a great dad! https://t.co/qyYPTNbcbq
1192,"Paid family leave is essential for kids, important for families, and good for businesses. Here’s what we’ve learned from our #paidleave program at the @gatesfoundation. https://t.co/1RtbS8wYEG"
1193,"Take big risks when you’re young and have little to lose. Know that failure is often a stepping stone to success. Develop a skin thick as rhino hide.

Fantastic advice here from @ariannahuff, Diane von Furstenberg, and other female founders. https://t.co/sCu0CKMYlS"
1194,"The first African woman to win a Nobel Peace Prize, Wangari Maathai was a trailblazer who dedicated her life to environmental conservation and women’s rights. Listen to her story on the @rebelgirlsbook podcast. https://t.co/gFFtx4DK8u https://t.co/CoxmSy8VDh"
1195,"What do Jane Goodall, Frida Kahlo, and Billie Jean King have in common? “A determination to trust themselves and the courage to break the rules.” https://t.co/vVAtjw3BdV"
1196,"“Recognize that when someone gives you feedback about your personhood as a proxy for your work, that they are actually telling you they have nothing constructive to say.”

A powerful piece full of powerful advice.
https://t.co/cEkVRD3i8J"
1197,"If venture capital firms don’t want to miss the next big idea, they need to get better about backing businesses led by women and people of color. Here’s why I’m investing in funds that do. https://t.co/Bs8I3Gp6MO"
1198,Advancing equality for women starts with gathering better data. It was great talking with @MollyWood about how we can do that. https://t.co/nzh1Smdo6p
1199,"“What we need, in response to #MeToo, is a global culture change in the workplace, from the Hollywood Hills to the corridors of power in Westminster, to the factory floors of Dhaka and back again, leaving no one out.” https://t.co/5KPeA4AYRc"
1200,Hans Rosling wrote Factfulness because he wanted to spread the message that progress is possible and we can all play a role in it. It’s the perfect book for young people graduating from college—so @billgates is giving all of them a free downloadable copy. https://t.co/JvavDmIK0h
1201,"As co-chair of the #G7 Gender Equality Advisory Council, our message going into this year’s summit is clear: it’s time to #MakeGenderInequalityHistory. Here are eight steps G7 nations can take to achieve that. https://t.co/YESwxqfpDR https://t.co/ST2vQMefjh"
1202,"Whenever I need something to remind me why I’m hopeful about the future, I remember there are heroes out there like Dr. Denis Mukwege. https://t.co/3mIzwL6eXi"
1203,"With two of my kids graduating this year, I went back and found the speech I gave at my own high school commencement. Decades later, I still stand by what I said. Here’s the last page. #TBT https://t.co/6OvqLQf9Iw"
1204,I can’t wait to see how a more diverse group of entrepreneurs will shape tomorrow’s innovations—from the products we build to the problems we decide to tackle. Thanks to @polina_marinova and @FortuneMagazine for a great conversation. https://t.co/ki9fGOzSeQ
1205,"I love that young women today can pick up a magazine, see women at the helm of billion-dollar tech companies, and get tips on how to build their own. https://t.co/URthr19ZkS"
1206,"Periods are a fact of life. Women and girls shouldn’t be sidelined by them—in sports, school, or their careers. It’s time to trade hushed whispers for open conversations about hygiene and health. #NoMoreLimits https://t.co/ENtPIaFy6E"
1207,To the #classof2018: I hope you make everything you can of this incredible moment in your lives. And I hope you take time to celebrate all the people who helped you get here. https://t.co/I6UlnUSVMr
1208,Any commencement speaker can encourage young people to live up to their potential. But graduates deserve more than encouragement from our country’s business leaders—they deserve action. https://t.co/i8U9DbWX8G
1209,"Two words: Thanks Canada! Today, @mclaudebibeau announced a new initiative to support grassroots women’s movements around the world. Change comes when we invest in those who fight for it. #EqualisGreater https://t.co/wsVJ7uIqOc"
1210,"For #RedNoseDay, @BillGates and I decided to #GoNosetoNose to help end child poverty with @comicrelief. We hope you’ll join us! https://t.co/0CbnCo9x3Z https://t.co/w8BKq6ZD93"
1211,I’m in awe of these remarkable women. Keep their stories on hand for the next time you need a dose of hope. #HowWellWin https://t.co/tKhBM1f3jH
1212,"I visited @UCF last fall—and everywhere I went, I saw professors going above and beyond to give their students a great education. Here’s why online courses are such a critical part of that work. https://t.co/TVGu8pXXNx"
1213,So many women making history today were once Girl Scouts. I love how this organization teaches girls to become leaders. https://t.co/ewEnajWfCB https://t.co/CzERze5c3T
1214,"Growing up, I didn’t see a lot of empowering female role models on TV. Today’s girls do. And this data from @GDIGM shows just how much that matters. https://t.co/F5JPn1jYqp"
1215,Offering mentorship. Mapping out a path to a degree. Being there when students need them most. Advisors at @MDCollege have gone to incredible lengths to support the #Classof2018—and now these young people are ready to make their mark on the world. Congratulations to you all! https://t.co/NtBalcObZ0
1216,College students come from a much wider range of backgrounds and circumstances than they used to. Their new realities require a new approach to higher education—and I’m excited to see schools like @UCF and @GeorgiaStateU leading the way. https://t.co/1XzGHi6jk9
1217,"RT @gatesed: How can today's college students get to graduation day? Join a conversation with @SueDHellmann @AllanGolston, and @BBurnsEDU o…"
1218,"When I was growing up, my mom taught me that I could be anything I wanted and supported me along every step of my path. I can still count on her for help, whether I’m wrestling with a tough issue or just need somebody to talk to. Happy #MothersDay, Mom. https://t.co/GT2CRIhXxl"
1219,"Like mother, like daughter. For the most part. https://t.co/eEwd0ngCRs"
1220,"RT @everymomcounts: Every mother counts, but not every mother survives. Together, we can change this. Donate today to help make pregnancy +…"
1221,"Growing up, I didn’t know a lot of moms who worked, but I always knew I wanted to be one. My daughter Jenn and I talked about what that looked like for our family. https://t.co/CfvYHHmIS3 #MothersDay https://t.co/A4m8SYWGNk"
1222,"Visiting Burkina Faso earlier this year, I saw firsthand how investments in women and children’s health are driving incredible progress. So, it’s especially fitting that Burkina Faso will co-host @TheGFF replenishment in November. https://t.co/DnQENglzEe"
1223,"Every time I travel overseas, I’m struck by the fact that we all have much more in common than we think. Dollar Street—a beautiful project from @AnnaGapminder—helps make that clear. https://t.co/GxrnBvGgIN"
1224,"“I never want to hear anyone say to my daughters ‘I’m not a math person’ or ‘my brain doesn’t think that way,’ because I believe these messages can reinforce the idea that you have to be born to be a math and science person. And that’s just not true.” https://t.co/Ior7bEtBfh"
1225,"This #TeacherAppreciationWeek, I’m thinking of Ms. Cochran. Her AP English class was really tough—but the high expectations she set and the care she showed for her students inspired us to aim high. I count myself so lucky to have learned from her. #ThankATeacher https://t.co/vfgx0k98EF"
1226,"What do seat belts, heart disease tests, and translation algorithms have in common? They were designed by men, for men—and as a result, they’ve never reached their full potential. https://t.co/RqZ7hTt5IN"
1227,A lot of #womenintech discover their passion for computer science like Angela did: years into a career in a different field. She has some great advice on finding your own pathway into tech. https://t.co/2UPr9JfM1C https://t.co/EHCCIlAdi3
1228,"Had a great time talking with @technology's @emilychangtv about my first career in tech, how Silicon Valley has changed, and why I’ve started investing in women-led VC firms. https://t.co/xbbB0X9M4F"
1229,"“I carried that child for nine months, then helplessly watched her die in my hands because she was not protected.”

This story is absolutely heartbreaking. And it should inspire all of us to act. #VaccinesWork (via @SueDHellmann) https://t.co/7OcQKqyZsS"
1230,"Gender equality is the foundation of a healthy, safe, prosperous future for all of us. That message rang loud and clear in Ottawa last week. https://t.co/XGvJGuOgPX"
1231,Imagine the difference if every lactation room was designed by women who’ve actually used one. https://t.co/4htY3ZfSZW
1232,"What’s happening in Garissa County, Kenya, is inspiring—and more proof that grassroots women’s movements will play an indispensable role in achieving gender equality worldwide. https://t.co/YckGli5ujx"
1233,"RT @gatesed: THIS SUNDAY: Watch @BillGates and @MelindaGates on @60Minutes, where they celebrate 20 years and the accomplishments of 20,500…"
1234,"Empowering women and girls belongs at the top of the global agenda. I’m glad to be working with @JustinTrudeau, @HudonIsabelle, and other members of the G7 Gender Equality Advisory Council to ensure that it is. https://t.co/QUGWD0xHjd"
1235,"The overwhelming love that a parent feels for their child is universal. Access to vaccines to protect our children from preventable diseases should be, too. #VaccinesWork #WorldImmunizationWeek https://t.co/go7dQQ2Z04"
1236,"#VaccinesWork. Getting your kids vaccinated is one of the easiest, most effective things you can do to keep them safe. https://t.co/PZ2QKKpTaO"
1237,"Anemia is common during pregnancy, and new research tells us it doubles the risk of maternal mortality. The good news is that it’s preventable—and by investing in nutrition, we can ensure more moms and babies lead healthy, prosperous lives. https://t.co/tSC1ynnVGb https://t.co/nneHFevpOF"
1238,"Sometimes, life-saving innovation looks like a new drug or a technological breakthrough. And sometimes it looks like this. https://t.co/oV4e7ntqEB"
1239,"As @BillGates writes, gene editing could help feed the world, end extreme poverty, and consign diseases like malaria to the history books. There’s a lot left to learn, but the potential is enormous—and I can’t wait to see the good this technology will do. https://t.co/ecn7VWBIpD"
1240,So inspiring. This is what it sounds like when women refuse to be silenced. https://t.co/c3fAhEZo17
1241,"By passing a commonsense policy to help working parents, the Senate is setting an important example. Simple changes like this can go a long way toward making our workplaces better for everyone. https://t.co/QhMmSxV1IJ"
1242,"Malaria has claimed millions of lives and destroyed untold human potential. If we take the right steps now, we can end this disease for good. #MalariaMustDie https://t.co/3WGOt3Ppen"
1243,"Between 2000 and 2015, the world cut the number of malaria deaths in half. Innovations like this make me hopeful we’ll do it again. 

#ReadyToBeatMalaria #MalariaMustDie https://t.co/dV1Q8BerBb"
1244,"@BrunoLeMaire Thanks for the wonderful conversation, @BrunoLeMaire! Your commitment to increasing France’s development aid is exactly the kind of leadership we need. These funds will fight extreme poverty and improve global health, making the world safer, healthier, and better for everyone."
1245,.@AminaJMohammed grew up the daughter of a herdsman in Nigeria. Now she’s the Deputy Secretary-General of the UN. Here’s how she’s working to empower women and girls around the world. https://t.co/WrrvPsFf70
1246,"Thanks for a wonderful discussion, @EmmanuelMacron and @JustinTrudeau. Your leadership on gender equality is critical. Our foundation looks forward to partnering with you during France and Canada’s G7 presidencies to ensure these issues remains high on the political agenda. https://t.co/ySybRxEYZI"
1247,"I’m inspired to see organizations like @appsandgirls working to close the gender gap in tech—and giving young women the tools to be innovators, entrepreneurs, and change-makers. https://t.co/JumKl1cbtI"
1248,"This data is deeply disheartening. But I’m glad we’re finally starting to collect it—because the better we understand the barriers working parents face, the faster we can dismantle them. https://t.co/8ZBZPRf21P"
1249,Amazing news from @reshmasaujani and @GirlsWhoCode. I can’t wait to see these girls change the world. https://t.co/CyjOwYsskv
1250,RT @shondarhimes: Ever thought about what you’d do with 20% more pay? @LeanInOrg asked women just that. Check out their answers in this #Eq…
1251,Let’s continue to demand equal pay for equal work. And let’s also go a step further by asking hard questions about what it will take to achieve equal work in the first place. https://t.co/Xy2V7Q8sR0 https://t.co/Gbu2Vrq9Su
1252,"Even in Scandinavian countries known for their family-friendly policies, the gender pay gap persists. This @nytimes piece explores the role that motherhood—and expectations about women’s roles—plays. https://t.co/pHVWH2XO46 https://t.co/gGCI397BJi"
1253,"In every country on every continent, women do more cooking, cleaning, and caretaking. On average, women around the world spend 4.5 hours more than men on household chores. This @qz tool helps measure the value of this unpaid, often invisible work. https://t.co/MnDukEZzUm"
1254,The data geek in me loves this @voxdotcom explainer. It makes a good argument that designing workplaces to be more flexible is the single most important step we can take toward closing the pay gap. https://t.co/nWEsgfz5Bk
1255,This @theeconomist analysis is an excellent deep dive into the issue. It also helps explain why some industries remain dominated by men and others by women—and why jobs in the former category tend to be compensated more generously. https://t.co/F4rHTQ8Inx
1256,"To begin to address the pay gap, we must understand what contributes to it, including societal norms around the role of women at home and the value of their labor. Here are some helpful resources about what’s causing the gap, and what it will take to close it…"
1257,"On #EqualPayDay, you often hear the rallying cry that women deserve “equal pay for equal work.” That’s true. But it’s also only part of the problem. (thread)"
1258,"Human brains are really good at recognizing patterns. If the vast majority of the leaders we see are male, we subconsciously associate leadership with men. The good news is that we can train ourselves to reverse that kind of thinking. https://t.co/fNsF6HPnPB"
1259,"From inventing a low-power laptop for children without reliable access to electricity, to developing a low-cost MRI device that could revolutionize healthcare, @mljmljmlj is changing the world, one innovation at a time. #TechMAKERS https://t.co/GmhgHBhf5n"
1260,".@emilychangtv and I had a fascinating conversation at #SXSW. We covered everything from what it was like to be a woman in tech in the 80s to getting more VC dollars into the hands of female founders. 
https://t.co/dzqT2e2I0y https://t.co/NBPOdpeV53"
1261,"Some of the most powerful women in Silicon Valley have teamed up to help more female founders and funders thrive. Their group, @AllRaise, is already making waves—and I’m excited to see what comes next.
https://t.co/IWNSJ3AD8H"
1262,"My friend Hans Rosling, who passed away last year, spent his life trying to get more people to understand what he called “the secret silent miracle of human progress.” You can download a chapter of his extraordinary book here: https://t.co/H7VRmc50Bw https://t.co/raLMN2g7w3"
1263,"Thank you, Hans and the Rosling family, for teaching us about our fascinating, surprising, and constantly improving world. https://t.co/NbAx0unswI"
1264,"The fastest drop in babies per woman in world history was in Iran, home to the largest condom factory in the world during the 1990s. https://t.co/EgFksuiG3J"
1265,The number of people who die from natural disasters is 25% of what it was 100 years ago. And the population has grown by 5 billion in that span. https://t.co/DSR1RqXYw5
1266,"When I graduated from college, there were 64,000 nuclear warheads on the planet. Now it’s down to 15,000. https://t.co/S38VYkS9om"
1267,"When I was 2 years old, 50% of people in the world lived in extreme poverty. Today, it’s 9%. https://t.co/ob9oLia7yR"
1268,"There is no such thing as a developing world on the one hand and a developed world on the other. It’s much more complicated than that, but we naturally think in terms of black and white. https://t.co/YSVSGb8LWH"
1269,"The world is better than you think! My late friend Hans Rosling’s new book, Factfulness, proves it, with his customary flair. It also explains why we tend to think the world is worse than it really is. Here are some of my favorite facts from the book. https://t.co/iquUXpwjJF"
1270,"This video from @StaceySolomon is a heartbreaking, hopeful testament to the way contraceptives change women’s lives—and their futures. https://t.co/1XfIcN4itM"
1271,".@devi_lo and @RubyAmeliaJ are two women to watch. As co-directors of @FRIDAfund, they’re connecting young leaders with resources to end violence, promote human rights, and build movements for equality.
#WomensHistoryMonth (Illustration by @KimothyJoy) https://t.co/jg1XEosnbJ https://t.co/HtYjxMCKxF"
1272,"When she first came to the U.S., Diana Trujillo worked tirelessly to put herself through college. Today, she’s the mission lead for Curiosity, the @NASA rover that’s exploring Mars. #WomensHistoryMonth https://t.co/vxiPqRjxt4"
1273,"Ayanna Howard is making history by designing a cutting-edge robot to help children with special needs live healthier, better lives. 

#WomensHistoryMonth (Illustration by @KimothyJoy) https://t.co/56Cbx9Uin8"
1274,"With support from @FRIDAfund, @SusanMueni18 started an organization that gives young women in Nairobi a place to learn and take charge of their futures. I love the name: Making a Difference Sisters—MAD Sisters for short. #WomensHistoryMonth (Illustration by @KimothyJoy) https://t.co/8Zh8g1XAga"
1275,"One of the things that binds our family together is our love of books. @johngreen's latest, Turtles All the Way Down, does exactly that. It struck such a chord with our daughter Phoebe that she decided to write her own review. https://t.co/0m9JUmafVN"
1276,"As @drfeifei says, “human values define machine values.” That’s why she’s working to make sure the machines shaping our future reflect the best of who we are. #WomensHistoryMonth #TechMAKERS https://t.co/En9yCK6pLv"
1277,Imagine having a personal advisor who could tell you exactly what your business needs to grow. That’s what @CarolynRodz created with @HelloAlice: a virtual assistant designed to make entrepreneurship more inclusive and accessible. #WomensHistoryMonth (Illustration by @kimothyjoy) https://t.co/BJaVzbGf7H
1278,Here’s my message for you… https://t.co/0X7JfRW6UI
1279,"Thanks, @SolarSTEAMGirls and @magssly! Your video made my day. https://t.co/KLNEpJoq3H"
1280,"When women in tech returned to work after a pregnancy, about 50% said the experience was great. But 25% rated it closer to horrible. That’s a disappointing outcome for an industry that prides itself on doing the impossible—and we should expect better. https://t.co/HXdujdboJr"
1281,"Meet Emily Pilloton. As the founder of @projecthdesign and @_GirlsGarage, she’s making history by empowering girls to build, engineer, and bring their ideas to life—and use those skills to lift up their communities. #WomensHistoryMonth (Illustration by @KimothyJoy) https://t.co/zornx0gVeq"
1282,"In a survey last year, just 3 percent of VCs rated diversity in tech as one of their top concerns. I’m hopeful these founders can push that number higher—and help create a startup ecosystem that’s truly inclusive.
https://t.co/3zHRl3uefs #FoundersForChange"
1283,"To be successful, every single one of us has to learn new skills—not just once, but throughout our careers. I talked with @CFair1 about what that means for the future of work. https://t.co/8TRrnJNm8c"
1284,.@johncary makes the case better than anyone I know: good design brings dignity to our lives. And we all deserve more of it. https://t.co/K9Ce4AgQHe
1285,"I wish @adafruit had been around when I was a kid because this looks like so much fun! Check out how Limor Fried is helping a new generation of engineers create, share, and inspire. #WomensHistoryMonth #TechMAKERS https://t.co/P82sLUZtjc"
1286,"Jess Tomlin is an inspiration. Her organization, @MATCHIntFund, is making sure grassroots women's movements get the resources they need to build a better, more equitable future for all of us. #WomensHistoryMonth (Illustration by @KimothyJoy) https://t.co/OTn6Zna4RQ"
1287,"It’s not just a pipeline problem, and it’s not just a culture problem. There are so many barriers keeping women and minorities out of tech—and this new report from @kaporcenter and @TheRealFreada is an important step toward breaking them down. https://t.co/b8LX5oCO1j"
1288,"New technologies, new business models, and new social movements are redefining work. At #SXSW, I talked with three innovators about how we can harness these changes for good—and create the first workplace in history that truly works for everyone. https://t.co/6ZUtH2HC1W https://t.co/J0OA5XaxTb"
1289,"“My philosophy on managing people is that they are people. They’re not employees. They’re humans, and humans have all kinds of things that go on.”

Entrepreneur @nancylublin on shaping the culture at @CrisisTextLine. https://t.co/daABLtulQb"
1290,"“In global health, gender equity is quite literally a matter of life and death.” 
 
Thank you, @SteveDavisPATH, for this essential piece.
https://t.co/qMajJnffT7"
