,text
574,It was great catching up with @ingridnilsen for #BookTube. We talked about what inspired me to write The #MomentofLift as well as my “proud pleasure” (love that she’s reframing “guilty pleasures!”). https://t.co/Zh4wFFEhYK]
575,"Each year, rather than making a resolution, I choose a single word to sum up my intentions for the next 12 months. The practice helps me stay grounded during hectic times. Here’s why I thought of 2019 as a year of spreading light. https://t.co/erWttAFslb https://t.co/lSYPhqEqLa"
576,"RT @MSuzman: The world must work together to slow the coronavirus outbreak, protect the most vulnerable, &amp; develop tools to control this ep…"
577,"Mark has been an integral part of our work at the @gatesfoundation for the past 12 years, and I’m looking forward to this next chapter with his leadership. https://t.co/iFFIHkjDvy"
578,"For the past five years, we had a doctor with perfect bedside manner taking care of the @gatesfoundation, and that was a very special thing.

The foundation will forever bear @SueDHellmann’s imprint. Thank you, Sue, for everything—both as a leader and a friend. https://t.co/xj5R3xxKEf"
579,1 in 4 people will experience mental health challenges. I’m inspired by young people today who are opening up the conversation about mental health &amp; to leaders like @elisha_london of @UnitedGMH who are working to put this issue on the global health agenda. https://t.co/aiFTyDW2RF
580,"How do we make Silicon Valley more inclusive? Maybe the answer is to start somewhere else.  
 
I’m excited to announce #GETCities, a new initiative to develop inclusive tech hubs in three U.S. cities over the next five years.  https://t.co/yuTR0YgfWU"
581,RT @gatesfoundation: We are committing $10 million in emergency funds and corresponding support to assist frontline responders in China and…
582,Now I’d love to continue the conversation with your book club via Skype. Enter the #MomentofLiftBookClub #Sweepstakes before the deadline on February 14th. Visit https://t.co/dT7RRi7nlv for more information.
583,.@ArielBissett asked a fantastic question during our #BookTube chat: How can we use social media to empower women? Here’s my response. https://t.co/Y64H2nNMDg
584,"Founded on the belief that all children, regardless of where they’re born, should have access to life-saving vaccines, @gavi has made incredible progress. https://t.co/rkUfxgdcdR"
585,"Meet Samir Saha and @senjutisaha, a father-daughter team who use data and innovative diagnostics to battle infectious diseases around the world. https://t.co/2GzlAuNb4r"
586,"We’ve been exploring the theme “gather” on Evoke. “Gather” is a word I love because it describes how something that starts small can become much bigger—and that’s my hope for Evoke, too. https://t.co/0yun6BSQpX"
587,"Today, as we honor Martin Luther King, Jr., let’s reflect on how we’ll speak up for ourselves—and for others. How will you use your voice? #MLKDay https://t.co/WaSUkvesV6"
588,Bravo to Commissioner @CathyEngelbert and the athletes of the @WNBA for making this “big bet on women”—an important step toward accelerating women’s power and influence in sports and beyond.  https://t.co/L0XbIBPqI3
589,"Here's how to enter: 

1) Fill out the entry form at https://t.co/dT7RRi7nlv 

2) Post to Instagram or Twitter (make sure your profile is public) with #MomentofLiftBookClub and #sweepstakes and share why you’re excited about this conversation. I can’t wait to chat with you!"
590,I wrote The #MomentofLift to spark conversations about the steps we can all take toward gender equality. I want to continue the conversation with your book club! Two winning book clubs will receive copies of The Moment of Lift and a Skype session with me. https://t.co/wl2RlMiJRZ
591,"Every day Americans deal with unmet needs in caregiving, and women are often left to pick up the slack.

It’s time for innovation around caregiving. That’s why we're partnering with @techstars to fund an accelerator focused on creative caregiving solutions for elder care. https://t.co/jHPH15Krpv"
592,And for those of who love a good book club discussion—stay tuned tomorrow for a fun announcement. #MomentofLiftBookClub
593,"It was such a joy to chat with @UzoAduba, @ingridnilsen, @ArielBissett &amp; @sashaalsberg about The #MomentofLift for #BookTube. We talked about how to make our workplaces more equal, what keeps us optimistic, and how we can help all women rise. https://t.co/bh9RgqwESf"
594,"When I visited @ava, @TilaneJ &amp; @ARRAYNow, I got to see firsthand how they’re disrupting norms &amp; building community around inclusive creativity. By supporting creators of color, they are making sure all voices can be heard. Congratulations, Ava and the cast of @WhenTheySeeUs. https://t.co/0LSPHuoi2y"
595,"I loved so many of the books I read in 2019. My favorites included “Talking to Strangers” by @Gladwell, “Home Work” by @JulieAndrews, and “Little Fires Everywhere” by @pronounced_ing. What did you read over the holidays? https://t.co/18d01QUWOn"
596,"I had a great conversation with @UzoAduba, @ingridnilsen, @sashaalsberg and @ArielBissett about The #MomentofLift. Excited to share the full #BookTube episode next week. https://t.co/tMwNIrpnht"
597,"How can we innovate to make sure technology supports teens’ wellbeing on the bumpy ride of adolescence? Through a year of conversations with teens and technologists, the innovators at @HeadstreamInno have gleaned four insights to help answer that question. https://t.co/D5TKjW7iRp"
598,"Over the next decade, I’m optimistic we’ll increase women’s power and influence around the world. I’m excited for the @gatesfoundation’s work with all of our partners to accelerate progress in 2020 and beyond. https://t.co/G1d07103o6"
599,Happy anniversary to @BillGates—the man who keeps me dancing through life. https://t.co/1Yf4l63AFy
600,"@MabelvanOranje Thank you, Mabel! I’m grateful for your support and for everything you’ve taught me."
601,I can't wait to see what 2020 holds. https://t.co/3xejFxm2z5
602,"And, on a personal note, the joys of long walks with friends, sharing great books and conversations with @billgates, and watching our children grow into amazing young people. https://t.co/kMg8yTUmzD"
603,The opportunity to make a new commitment to support advocates and experts working to expand women’s power and influence in the United States. https://t.co/PXPyOjEBwC
604,"Time in Ethiopia, Kenya, and South Africa to connect with women who are farmers, CEOs, researchers, teachers, activists, and even a president. https://t.co/5mo7H4TNiw"
605,"The #MomentofLift book tour, which allowed me the chance to have conversations about gender equality with people all over the country. https://t.co/VajVxBRXqp"
606,2019 gave me so many reasons to be grateful: https://t.co/ZOrSPvLIfz
607,"There's something about this time of year that will always be pure magic to me. May your holidays be full of warmth, wonder and time with those you love. https://t.co/7oolA1jywp"
608,"I love this beautiful painted edition of The Moment of Lift, handcrafted by my daughter’s friend.

I’m so impressed by her skill and thankful for this thoughtful gift! https://t.co/nqj6NwjkNt"
609,One of my favorite holiday traditions is the Jingle Bell Run. I love seeing so many Seattleites turn out in festive costumes (or Santa headbands! 🎅) to raise money for a good cause. Hope you’re having fun gearing up for the holidays. https://t.co/xdJv1DVHcR
610,"Sir Fazle was a humanitarian who helped us learn about development work: Building an efficient organization while never forgetting who you were doing it for. We were saddened to hear of his passing and will forever draw inspiration from his work, as will the rest of the world. https://t.co/wuXsQdUsBW"
611,"“As demographics in the United States shift towards womxn of color being the majority of new hires, the world of work has to shift.”

– @appyrae and @SageQuiamno of @FutureFor_Us, a platform to advance women of color at work https://t.co/t1r5KewFdY"
612,"My hope for the next decade: Women will increasingly be the ones making decisions, controlling resources, shaping perspectives, and solving our collective challenges. https://t.co/01lcSoW7Uk"
613,"In sub-Saharan Africa, 4 out of 5 new HIV infections are among girls. To #EndAIDS, women and girls need HIV prevention options that better fit their lives and can help them control their futures. https://t.co/DN1RzH8B7c https://t.co/1mvjbWbawN"
614,"The Senate approved #paidleave for 2M+ federal employees when they become parents—an important step toward a comprehensive policy for all U.S. workers. Grateful for the bipartisan support from lawmakers &amp; advocates &amp; the tremendous progress on this issue.
 https://t.co/HCiG1MOahF"
615,"Where women gather, powerful things happen. On Evoke, @amy_riveter shares five places and spaces where women find community. https://t.co/NIVpqtichC"
616,.@BillGates' favorite books of 2019 included An American Marriage by Tayari Jones and Prepared by Diane Tavenner. What were your favorite reads? https://t.co/LWt6WNNjTO
617,"@MarkDuplass Thanks for your support, Mark!"
618,"Universal health coverage is a cornerstone of a more equal world. On this #UHCDay, let's renew our determination to ensure everyone—including women and girls—has access to the health services they need and deserve. https://t.co/vfCbewgIZa"
619,"This is a fascinating look at how bias in technology has affected how we perceive women’s voices, and how we can better design tech to overcome that bias. https://t.co/rJfeKbSFAh"
620,"Today, as we kick off Computer Science Education Week, we celebrate #GraceHopper, an inspiration to so many women in tech. Born on this day in 1906, she was a mathematician, a professor, a Navy admiral and a pioneer of computing. #WomeninSTEM #CSEdWeek https://t.co/OyhilpDWuz"
621,"Sue, you brought so much to our foundation—scientific expertise, a talent for bringing out the best in others, and a deep commitment to making the world healthier and more equal. You made us better in so many ways. Thank you for everything. https://t.co/gt10oxtUyu"
622,"Parents often ask me how they can encourage their children to give back. Here’s a lovely way to start, from 12-year-old Khloe: #GivingTuesdayKids! https://t.co/WNYmDgNjJd @GivingTuesday https://t.co/PlKmFHZD6m"
623,"I’m so excited about this new series from the @gatesfoundation, “Sick History.” You’ll learn about the disease that had the biggest impact on human history in the first 10 seconds of the first episode! https://t.co/5dr94Kuvj3"
624,"A very happy birthday to Bill Gates, Sr.—a wonderful father, grandfather, and one of the most generous people I know. We love you! https://t.co/y8FjmiPXpJ"
625,"A great book is one of my favorite gifts for the holidays. If you need inspiration for the readers on your list, @wellreadblkgirl has a stack of wonderful recommendations—as well as a mission to nurture, celebrate, and amplify the voices of Black women writers and readers. https://t.co/AdNGREv851"
626,"There's so much to be grateful for this year, but these four will always be at the very top of my list.

From our family to yours—Happy Thanksgiving. https://t.co/mGaPAyw3YA"
627,"Change doesn’t just happen—committed people work together to achieve progress. I loved talking to women in tech in Nairobi about the growth in their community, from a handful of women to a network over 10 years. Also honored to have a locker named for me at @kayana_kenya! https://t.co/4gjcs6PTwo"
628,"The data shows that investing in diverse founders brings incredible opportunities and increased revenue, but venture capitalists are still leaving out women &amp; people of color.

@carlaannharris shares why VCs should start investing in female-led start-ups. https://t.co/pTEXI1hn3J"
629,"Nearly three years ago, I wrote this piece about the power women have when we come together.

Today, women are still demanding progress—but here's what's changed: The world is finally listening. https://t.co/oz2E0wqIuJ"
630,"Working toward equality at home starts with courageous conversations about how you divide up household responsibilities. @eve_rodsky wrote ""Fair Play"" to help encourage these conversations. Have you read it? 
 
Thanks to @hellosunshine for the rec! https://t.co/T6lN8AWll0"
631,"In case you needed proof of my fandom, here’s a photo from my “Sound of Music”-themed birthday party for my 50th. https://t.co/wJZcJbXBtU"
632,"I was excited to join @JulieAndrews, to celebrate the launch of her new book, “Home Work.” https://t.co/8X1sxzJQRe"
633,"Here's a great new Evoke piece from advocate and self-described ""dangerous woman"" @patmitchell on the powerful ideas born in rooms where women gather. https://t.co/dhRW8Bk94c"
634,"Today is #LatinaEqualPay Day, marking how far into 2019 Latinas had to work to be paid what the average white man was paid in 2018 alone. 

Let’s close this gap. @EvaLongoria shares what companies and employees can do to help. https://t.co/D8zrIHfD7L #EqualityCantWait https://t.co/vmErX7SLR5"
635,"Let's build tech that makes the ups and downs of adolescence easier—not harder.

@HeadstreamInno is launching a challenge to do just that, and I'm thrilled to support it. 

Learn more and apply here—I can't wait to see what we make together. https://t.co/NYcZw7dqTf https://t.co/jEcoIdRlNh"
636,"Happy #NationalHikingDay! Here's a shot from a hike I did on a recent trip to Cape Town. Wherever you are in the world, I hope you can get out and explore for a bit today—even if it's just in your own backyard! https://t.co/jbRoD8uYEk"
637,"In Nairobi, I got the chance to reconnect with @OfficialJMbugua, @RabbitTheKing, and more incredible Kenyans fighting for gender equality. I learned about the great work they’re doing to dismantle the barriers that hold women back. It was wonderful to see these inspiring leaders. https://t.co/3IQbMBklvS"
638,"Investing in women’s health and the future go hand in hand. Thank you @OfficialJMbugua, @LinaAbirafeh, Dr. Gita Sen, &amp; @neillomibao for the fantastic discussion at #ICPD25 to mark the progress we’ve made—and the work that lies ahead. https://t.co/vVhkHUuMD0"
639,Digital technologies have great potential to help those living on the margins but only if they are deliberate about being inclusive. An action plan from @p4pcommission lays out how everyone can benefit from the opportunities created by the digital economy. https://t.co/dXsV0bubZw https://t.co/Mfz3BScqh3
640,"Thank you, President Kenyatta, for hosting #ICPD25 and for the great progress Kenya has made to increase access to family planning for women and girls. https://t.co/gFR2fgXIqK"
641,"All of these girls told me they want to be mothers—and they want to be good ones. And now, they see family planning as a stepping stone to that and everything else they dream of. https://t.co/Lm3nnOVlVp"
642,"It starts with the things young married girls and their husbands care about—healthy kids, a more prosperous future—and helps them understand how family planning fits into that future. https://t.co/UasYo8Z6GU"
643,"In Ethiopia, I got the chance to learn about Smart Start—a program from @Adolescents360. In rural areas with traditions of early marriage &amp; pregnancy, Smart Start is empowering adolescent girls to think differently about how many kids they want &amp; when they want to have them. https://t.co/PrSvfzOFow"
644,"Improving the lives of women and girls should be central to every government‘s agenda. Thrilled to meet with President @SahleWorkZewde, PM @AbiyAhmedAli, cabinet ministers and gender advocates to discuss their commitments to gender equality in Ethiopia. https://t.co/bahcby7vMn"
645,"I agree wholeheartedly with advocate Andrew Millan: ""Investing in family planning, especially in the lives of young people, remains the smartest investment any nation can make at any time."" https://t.co/J7s0NdLoki"
646,Honored to see The #MomentofLift nominated for a #GoodreadsChoice award alongside so many other wonderful books! What was your favorite book this year? https://t.co/XSO1ZUtvge
647,"AI is going to change our world—it’s up to us to make sure that change is for the better. 

I’m excited about Open Learning. It’s a new @ai4allorg program that helps educators teach students to apply AI to problems they’re passionate about. #NationalSTEMDay https://t.co/1m2Z8WzCjB"
648,"Last year, my company, Pivotal Ventures, along with leading tech companies, launched #RebootRepresentation, to double the number of underrepresented women of color earning computing degrees. Here’s an update on the progress from CEO, Dwana Franklin-Davis. https://t.co/1vb7lZ7Iow"
649,"In her @HarvardBiz piece, @jenkleindc, makes this crucial point: Sexual harassment doesn't happen in a vacuum. It's founded in broader biases, barriers, and discrimination. It's time to break the cycle. https://t.co/mEcLwdlZQj"
650,".@michellepking asked 72 employees the same two questions about gender equality in their workplaces. 

She wrote about her findings—and how leaders can create a culture free of gender bias—for Evoke.  https://t.co/zsT7c5fqDm"
651,"I love this conversation with Workin' Moms actor and director @reitcatou on raising kids, running an all-women writers' room, and giving ourselves grace.  https://t.co/VRkDST08my"
652,"2018 was a groundbreaking year for women in political office, but there is still more work to do. What have we learned since then—and what does it mean for future elections? 

@CAWP_RU is out with a fascinating analysis. 

Give it a read.  https://t.co/uATIm10upE"
653,"While in Johannesburg this week, I had the opportunity to meet with advocates working to end gender-based violence in South Africa. It was an honor to hear their stories and learn more about their work. https://t.co/sovLoja45x"
654,Everyone needs a fun Halloween mug! #HappyHalloween☕👻 https://t.co/6P5BYeEI8b
655,"A wonderful day in Johannesburg. 

Thank you to journalist @RediTlhabi, the @NelsonMandela Foundation, and everyone who came out for a conversation about The #MomentofLift. https://t.co/mfT4NtCgev"
656,"Every year, this birthday hat has come out for family birthdays and has traveled with us for nearly 20 years. Today it’s Bill’s turn again—happy birthday, @BillGates! ❤️ https://t.co/8HdYiGOuQZ"
657,Such a fun and wide-ranging conversation with @GuyRaz for his new podcast #WisdomfromtheTop. Check it out here. https://t.co/mzrSmphwdI https://t.co/AyUY483p9F
658,"“When we start discussions about the gender or racial wealth gap with ‘It’s hard,’ we are basically saying we have permission to fail.”
 
@Thasunda has some big ideas on how we can start closing that gap.  https://t.co/ZjUhsVtKK6"
659,"In August, Nigeria reached 3 years without a case of wild polio.
 
It happened thanks to the fearless efforts of some 20,000 women volunteers who go door-to-door to vaccinate children.
 
Today, we celebrate these true heroes in the effort to #EndPolio once and for all. https://t.co/jn7JP6bVZb"
660,"""The United States is better off as a nation when more women are making decisions, leading conversations, and crafting policy.""

Amen. https://t.co/t401P52qDG"
661,"Every parent should have access to #PaidFamilyLeave, says @alexisohanian–and I couldn’t agree more. Today, on Dad’s Day of Action, he's partnering with @PaidLeaveUS to advocate for paid leave for all. Read more on why paid family leave is important here: https://t.co/PcCUkaLbsO https://t.co/t9RAIFQeX7"
662,"The late Toni Morrison wrote: “Outlaw women are fascinating—not always for their behavior, but because historically women are seen as naturally disruptive and their status is an illegal one from birth if it is not under the rule of men.” 

What does this quote mean to you? https://t.co/qU5dzHZdZH"
663,"With today’s launch of @NASA's first #AllWomanSpacewalk, I’m thinking about the incredible women who worked with my dad on the early Apollo missions.

Today I’m cheering on @Astro_Christina, @Astro_Jessica and their entire team for inspiring girls to dream big! #EqualityCantWait https://t.co/MGNlkwMdRN"
664,Learn more and apply: https://t.co/9PgjIB07rj
665,"Right now, only 2% of venture funding goes to women-led startups, and that’s a barrier we have to dismantle. As @Microsoft’s @PeggyJ says: The status quo is costing us all.

That’s why Pivotal Ventures, @M12vc, and @MayfieldFund are excited to announce #FemaleFoundersComp. https://t.co/2tcRR2zqUX"
666,"Congratulations, Esther, Abhijit and Michael! Your work makes me hopeful about the progress we're making in the fight against global poverty. https://t.co/aliLQ3Eci8"
667,"Thank you for sharing your voice at #Goalkeepers19, @BlessingOmakwu! https://t.co/uHoKBbkiFC"
668,Why aren’t there more women in senior roles at work? The #WiW2019 report from @LeanInOrg &amp; @McKinsey finds that the biggest systemic barrier is the “broken rung”—the first step up to manager. Learn how we can fix this. #EqualityCantWait https://t.co/l3kj3kLg8y
669,The unprecedented energy and attention around gender equality makes this a moment when extraordinary progress is possible. Learn more in my conversation with @HarvardBiz's Ideacast podcast. https://t.co/vyPAU3ujjb
670,These young leaders from @riseupforgirls are using their voice to fight for change in their communities. Read what they have to say. #DayoftheGirl #RiseUpTogether https://t.co/v03SbBCqgk
671,"RT @vowforgirls: Every 3 seconds, a girl is married. Not if we have anything to do with it!

POST a photo of your ring finger + TAG #vowfor…"
672,"“It is time to start recognizing care as a real and invaluable part of our lives, by seeing it, supporting it, and solving for it. It’s time to do care like we care.” 👏 https://t.co/RrwVO4pQZC"
673,I love a good chart. Here are six from the World Economic Forum’s Global Gender Gap Report that tell an important story of the areas where we’re making progress on gender equality around the world—and where there’s more work still to do. https://t.co/qqHXB505cE
674,"A striking finding from a new poll @eqltycantwait conducted in partnership with @TIME:

An overwhelming majority of Americans believe gender inequality exists. But men don’t consider the problem to be as severe as women do.
#EqualityCantWait https://t.co/6aDGkjDh4b"
675,.@TIMESUPNOW isn't just driving the conversation forward on gender equality—they're helping to ensure the workplace becomes a place where everyone can thrive. I'm excited for @TinaTchen's leadership &amp; to see what the Impact Lab can do for all of us. https://t.co/hiWT1JcRp7
676,Stigma around periods can keep girls and women around the world from participating equally in school and work. @EmmaBarnett's #Period is an information-packed and hilarious book that aims to change the conversation about periods. https://t.co/QS0Sv6F4gT
677,This is encouraging: a new study has found women are slowly shifting to college majors that lead to higher-paying careers. https://t.co/PFSQgdONko
678,"The tech industry has changed the world. But how can we change tech to address the gender inequality that persists within the industry?
 
@rebeccak46 makes a compelling case for venture capital as a force for equality in tech. https://t.co/yCeI3x5cZz"
679,"When I talk to people around the country about gender equality, the question I hear most often is “What can I do to help?” 

My answer is always: You have a voice in shaping our society. 

Here are nine ideas for how to use it. #EqualityCantWait https://t.co/QT0nHhBzmR"
680,"RT @rebeccak46: This month, @HarvardBiz has a series on closing the gender gap starting w a great piece by @melindagates. I wrote some idea…"
681,Here’s why I believe we need to focus on expanding women’s power and influence in the United States. https://t.co/6xUzqQXAaL #EqualityCantWait https://t.co/F407sIGsNs
682,"I want to see more women making decisions, controlling resources, &amp; shaping policies. That’s why I’m committing $1B over the next 10 years to expanding women’s power &amp; influence in the U.S. #EqualityCantWait, &amp; no one in a position to act should either. https://t.co/Rh6SkRH0ma"
683,"RT @PanMacmillanSA: .@PanMacmillanSA and the @NelsonMandela Foundation are delighted to host @melindagates, in conversation with @RediTlhab…"
684,"The @USWNT has inspired the world—with their on-the-field performance and with their fight for gender equality. Thanks, @mPinoe, @TobinHeath, @ChristenPress and @meghankling for sharing this message with #Goalkeepers19! https://t.co/FTGyYNfCBU"
685,"I believe something fundamental has started to shift in the U.S. and around the world.

Women are sharing their stories, marching, walking out, running for office, and winning in record numbers.

But this window of opportunity won't last forever. Now is the moment to act. https://t.co/DKgWIvZvpb"
686,"When women’s and children’s health is a priority, lives change. I saw it when I visited Burkina Faso in 2018, and I am thrilled to solidify our partnership to improve health and nutrition for families. Thank you, President @rochkaborepf, for your leadership. https://t.co/JHqTdaaeDc"
687,Sometimes you’re in the mood for a beach read—but what about when you’re in the mood to tackle big challenges? Here is a collection of books from #Goalkeepers19 that will leave you feeling inspired and ready to take action. https://t.co/eaSWSIdAlK
688,"When I found out we’re still 208 years away from gender equality in the U.S., I quite simply couldn’t believe it. Here’s what we can do about it. https://t.co/ut8WlRSe7F"
