,text
0,"When women and children thrive, communities and economies flourish. This message is at the heart of @theGFF's work, and I was delighted to join @AwaMCollSeck @MariamAbdou2 and @TheoSowa to discuss the GFF’s growing impact. https://t.co/jqWUmWn8lf"
1,"By building up care economies and cash transfer programs—and using data to track our progress—we can come back from the pandemic more prosperous, prepared, and equal than we entered it.

Thanks to @MasoodCGD, @JKlein46, and @ZShamsuna for such a thought-provoking talk at @CGDev. https://t.co/rh4GeEB4qd"
2,"As leaders come together for the @WorldBank spring meetings to address urgent challenges, they must not overlook informal women workers. These women can be the engine of our global recovery—and the backbone of a more #ResilientFuture. https://t.co/ohwfhrxUBc"
3,"Wishing hope, joy, and renewal to everyone celebrating today. Happy Easter!"
4,"When money flows into the hands of women, everything changes—families benefit, communities transform, and economies improve. By shattering this glass ceiling in venture capital, @SallieKrawcheck and the @Ellevest team are helping us all reach new heights. https://t.co/WPGZRY2iuQ"
5,"Thanks to @BrkThroughTech's new program for college students, more women are getting the training and mentorship they need to gain access to careers in AI. 

I can't wait to see how these students transform our future. https://t.co/6nI0Z3wADg https://t.co/tJf3reWgKI"
6,"Families keep telling us they can’t work without child care, especially women in countries hit hardest by COVID-19.

It’s encouraging to see some world leaders listening. Thank you @SvenjaSchulze68 and @BMZ_Bund for giving this topic a platform at @G7."
7,"Congratulations, Judge Jackson, on becoming Justice Jackson. You’ve said you stand on the shoulders of Constance Baker Motley, the first Black woman to serve as a federal judge. Now, future generations will stand on yours. https://t.co/gU0DvO0ALh"
8,"In my experience, the most important conversations happen at the dinner table, not in the board room.

Thank you @AnitaZaidi, @findingpneumo, @catherinenyamb1, @daktari1, for this meaningful conversation on pandemic-related inequities and how to end them. https://t.co/V2jWT3GQes"
9,"What if we could save 150,000 more lives globally? Kangaroo Mother Care, which encourages skin-to-skin contact between a mother and her newborn, could do exactly that.

Sometimes the most powerful public health interventions are the simplest.  https://t.co/vNe4HOiYfG"
10,"When it comes to contraception, everyone has different needs—and local family planning programs are often in the best position to meet them.

Excited to see @Amref_Kenya and @Pop_Council Nigeria lead @FP2030Global's new African hubs. https://t.co/VIbzrSNJnJ"
11,"As we celebrate #WHM, it’s easy to imagine moments like women’s suffrage or Title IX’s passage as foregone conclusions. But history didn’t just happen—people made it happen. 

I teamed up with @CBSMornings to highlight three leaders making history today: https://t.co/NmNTTlh8f4"
12,".@ava has powerful advice for young women who want to take a bold next step or start something new: “Begin. Don’t wait for permission to begin. Just begin.”

Watch our full conversation: https://t.co/YwgrEMrIPg"
13,"It's hard to be what you can't see.

I love this #WHM exhibit from @IfThenSheCan and @smithsonian, which honors modern-day women innovating in STEM. I hope it inspires young women everywhere to imagine themselves as the next trailblazers. https://t.co/DQpAsQSXo5"
14,RT @MSuzman: The @gatesfoundation is committed to eradicating preventable diseases like tuberculosis &amp; we know a fully funded @GlobalFund c…
15,Inspiring. https://t.co/eci2mI7wAE
16,"As a pioneering force behind the Moderna vaccine, @KizzyPhD is committed to fighting vaccine hesitancy—or as she likes to call it, “vaccine inquisitiveness.” She shared more about her approach during our @CBSMornings #WHM conversation. https://t.co/RZVlDinB7l https://t.co/7fZb2IqIRZ"
17,"Her work, leadership, and wisdom will echo for generations to come."
18,"The world lost one of its luminaries today. Madeleine Albright advanced our country’s highest ideals of freedom, democracy, and human dignity. As the first female U.S. Secretary of State, she never stopped inspiring women to use their voice."
19,"We know that empowered women transform societies, yet the data show that the path to true equality is still years away, missing the mark for #SDG5.

Progress is still possible—but only if we put women at the heart of policies, programs, decisions, and pandemic recoveries. https://t.co/sXyWVvVC1k"
20,I sat down with @ava to hear more about her ongoing efforts to support diversity and inclusion in the film industry through her company @ARRAYNow—a great way to round out this special #WomensHistoryMonth series on @CBSMornings. https://t.co/G4pH4buIJb
21,".@BRACworld has been a close partner of the @gatesfoundation for more than 15 years. As #BRACTurns50, I’m celebrating the work they've done, the lessons they've shared, and the future they are working to build. https://t.co/SJ013mo7Xi"
22,"As we celebrate #WomensHistoryMonth, we must also acknowledge that we remain more than 200 years away from gender equality. We can’t afford to wait that long. 

In my interview with @USAToday’s @suzyscribe, I talked about ways we can accelerate progress. https://t.co/ZW5S0cA7hS"
23,"When it comes to advancing gender equality, the best solutions often come from local communities.

@CoImpactCollab understands this issue, and I’m proud to join with other donors to learn from and invest in those working to advance global gender equality through the #GenderFund. https://t.co/9JV48lxUHP"
24,"If you’re looking for a role model this #WomensHistoryMonth, look no further than @KizzyPhD. Not only was she instrumental in developing the Moderna COVID vaccine, her commitment to science and brilliant outlook on life are nothing short of inspiring. https://t.co/f9606mzMfq"
25,"I recently sat down with @CBSNews’ @JamieYuccas and @AijenPoo, a labor activist leading the fight to reform our country’s broken caregiving system. We covered the #CareEconomy, its impact on women and families, and the opportunity it holds for our society. https://t.co/iYggtd4czH https://t.co/zGbeeAWG3b"
26,"Women often tell me that child care is one of their greatest barriers to earning an income.

Jashodaben Pravinchandra understands this reality all too well—she struggled to manage care and work until a child care center helped her create a better future for her family. https://t.co/01F8Vsjom7"
27,"To celebrate #WomensHistoryMonth, I'll be sharing trivia about some amazing trailblazers both past and present.

Keep an eye on my Instagram stories for our first clues. ➡️ https://t.co/E19hCRRC2N https://t.co/xzujrhoUpq"
28,"I'm excited to kick off a special #WomensHistoryMonth series spotlighting three extraordinary leaders who are making history today. My first conversation is with @aijenpoo, one of the most dedicated advocates for caregivers in the US. https://t.co/zKBxJRtXHX"
29,"RT @BJKLInitiative: Join us on Tuesday, March 15 at 1PM ET for the ""PowHER Redefined Virtual Symposium"" featuring an incredible line-up of…"
30,"RT @CEPIvaccines: ""A commitment to CEPI is a commitment to science, to equity, to partnership."" 

@DrTedros spoke today about the power of…"
31,"To mark #InternationalWomensDay, I joined @reenaninan and Nobel Prize-winning economist Esther Duflo on @ForeignPolicy's HERO podcast to discuss why women's economic empowerment is essential to the COVID-19 recovery.

Listen here 🔈:  https://t.co/XRtB7o4IzO"
32,RT @POTUS: I’m proud to announce that I am nominating Judge Ketanji Brown Jackson to serve on the Supreme Court. Currently serving on the U…
33,"Women and girls are disproportionately affected by #HIV, #TB, and #malaria.

@GlobalFund works to address those disparities, saving millions of women and girls and empowering many more.

Invest in gender equality and human rights. #FightForWhatCounts https://t.co/uzjKK2gvDa"
34,"Most importantly, he believed in the sacredness contained in every single person, and his commitment to making the world better encouraged other people believe in it, too. I will miss my dear friend, and continue to be inspired by him, every day. 
https://t.co/chkEz21kAh"
35,"I’m heartbroken that my teacher, mentor, &amp; friend Paul Farmer is gone. He taught me what it means to listen—to really listen—instead of charging in with my own solution. He showed me how to channel my anger about the barriers that hold people back into relentlessness &amp; optimism."
36,"In case you missed it, watch the recording of the live Demo Day event here: https://t.co/WcBKcZaZP6"
37,RT @G4GC_org: It's not too late to register for this Friday's #BlackGirlFreedomWeek free interactive youth-led sessions! This is a space de…
38,"If you’re looking for a reason to be hopeful about the future of caregiving, join me today for the @TS_Longevity Demo Day, where we’ll hear from some of the most innovative companies creating solutions for older adults and their caregivers.

Register here: https://t.co/3GXtTFgQhs https://t.co/9DkQqujUtG"
39,RT @TS_Longevity: TODAY is #TSLongevity DEMO DAY! We are proud of these 10 companies and how they are changing the world to address the unm…
40,"With this many doses, we should have been able to give every person on earth at least one shot. Instead, the majority of vaccines have gone to the wealthiest nations, leaving low-income countries behind. https://t.co/e2iuGZwXVf"
41,"The #AfricanMedicinesAgency will help accelerate access to life-saving health innovations where they're needed most. We’re proud to partner with @NEPAD_Agency, @JuttaUrpilainen, @EU_Partnerships, @EMA_News &amp; others in this African-led effort. #AfricaEU https://t.co/529xiyhjBg"
42,"Grateful to the @gatesfoundation Black Philanthropic Partnership employee resource group, which put together this thoughtful call to action for #BlackHistoryMonth. https://t.co/2fdioZUy04"
43,"RT @NASA: Hired in 1955 as a human computer, Annie Easley led a 34-year NASA career developing software code for numerous programs. Her wor…"
44,"As more people grow older, we need to make better investments in our care infrastructure.

In case you missed it, this report from Pivotal Ventures and @the_holding_co shows us how. https://t.co/cqUMS0bBlW"
45,"From scientific discoveries in space that can help us on Earth, to greater international cooperation, Jessica Watkins reminds us what’s possible when we shoot for the stars.

We’ll be watching your history-making trip and cheering you on from afar. 🚀 https://t.co/Hg7VnCej1g"
46,"The inequitable response to COVID-19 has allowed the pandemic to rebound around the world. That's why the @gatesfoundation is investing in @CEPIvaccines, an organization that puts equitable access to vaccines at the heart of its mission."
47,How many deaths could have been avoided if lower-income countries had the same access to vaccines as higher-income countries? The answer is staggering. https://t.co/1vyjlve1dq
48,"The @GatesFoundation's new board members share the values that have guided us for the past 20 years, and they possess the vision needed to drive the work that lies ahead. I am excited to work with these strong, qualified leaders. 

https://t.co/VsS5rwH0TP https://t.co/CcneMvIB3m"
49,A tough but important look at the decades of progress lost to the pandemic—and yet another reminder that we need to place women and girls at the center of our recovery efforts. https://t.co/FYZ2R4u7lw
50,"Not *technically* a selfie, but can I get a pass since we didn't have smartphones in the 80s? 🤣

This shot from the @ngadc takes me back! #MuseumSelfieDay https://t.co/Mnbkj0ULnL"
51,At the core of @CEPIvaccines' mission is a commitment to equitable access. That's why the @gatesfoundation and @wellcometrust are each committing an additional $150 million to support its critical work to increase access to vaccines. https://t.co/niQhKglI3b
52,RT @MichelleObama: What a fitting tribute to have Dr. Maya Angelou become the first Black woman on the U.S. quarter—she was a phenomenal wo…
53,Absolutely thrilled to see @GETCities expanding to Miami! https://t.co/O2Ba8OQeCX
54,"RT @gatesfoundation: “If we end inequity, we end the pandemic.” https://t.co/4BDjE7SEGD"
55,"2021 was packed with so many good reads. These are just a few of my favorites. 

Show me your stack in the replies! 📚 https://t.co/Lr01G37Zb5"
56,"What does it take to achieve gender equality?

This story of advocates, communities, and government coming together in Kenya offers a roadmap for change. ⬇️ https://t.co/bBYu7P5Sn8"
57,"Here's to 2022 being the year that we put women at the heart of our pandemic recovery by prioritizing their voices, well-being, and success.

What are your hopes for 2022?"
58,"With a moral light that graced his every act of service, Desmond Tutu answered apartheid with the gifts of a healer. He fought for a world marked by forgiveness, free from injustice, and rid of HIV/AIDS—a world where every life is valued. I will miss my dear friend."
59,These faces have always been the best Christmas gift. Sending warm wishes to you and yours this holiday season. 🎄 https://t.co/kieVA6BhMi
60,"RT @gatesfoundation: ""If women are not part of the workforce, that will have a ripple effect in the whole economy, the whole society,""
http…"
61,"This is the time of year I love looking back on the things that inspired me, challenged me, and gave me hope. https://t.co/lYKFVSuulu"
62,"Dedicated scientists and years of investment in R&amp;D in southern Africa made the detection of the Omicron variant possible.

This discovery and transparency will save lives—but the only way to end the pandemic is to ensure everyone has access to vaccines. https://t.co/EG3LDMHwV7"
63,RT @PaidLeaveUS: We need a national paid family and medical leave policy so people can recover from an illness or care for their loved ones…
64,"This #CSEdWeek, I'm thinking of all the young women writing algorithms, studying computer architectures, and holding their breath to see if their code compiles with no errors.

Like the girl in this photo, your adventures in tech are just beginning. https://t.co/jVYqewwnzT"
65,"RT @gatesfoundation: We need to ensure that this is an economic recovery that works for everyone.

How can YOU help? Think globally this #G…"
66,"In 2010, I committed to giving away the majority of my resources in my lifetime.

Today, I’m reaffirming that commitment. https://t.co/QbOwK2Y8SJ https://t.co/1nKYLg9WcP"
67,"At some point, most of us will need time away from work to care for ourselves or someone we love. But the U.S. is the only industrialized country that doesn’t guarantee paid leave of any kind.

Congress has an opportunity to pass national #PaidLeave. Let’s make sure they do! https://t.co/nYsfxNZRwe"
68,"Thankful, thankful, thankful.

Wishing you and yours a very #HappyThanksgiving as I reflect on holidays past with these three turkeys. 🦃 https://t.co/vdlt9SZz90"
69,"With the House passage of #BuildBackBetter, we are one step closer to guaranteeing #PaidLeave for all workers and strengthening our care infrastructure. Now the Senate must act on this historic opportunity to invest in women, families, and the economy by passing this bill."
70,"Good news: Today, we're celebrating the launch of a new, more diverse, country-driven @FP2030Global movement.

I was grateful to speak with leaders like @SamukelisoDube and @nskaoma06, who are helping build a world where all women can plan their future. https://t.co/U9DOkqgwXw"
71,".@DVF has built her career on helping women express themselves. So when she asked my best advice for women leaders, the answer was easy—be your true self.

Thank you Diane and @Womens_Forum, for the honor of being recognized with your 2021 Lifetime Leadership Award. I am humbled! https://t.co/rSCUYG1ysH"
72,"Happy #TakeAHikeDay!

No matter where I go, hiking is one of my favorite ways to decompress and get moving.

What’s your favorite hike? This one in Cape Town, South Africa, was one of mine! 🥾 https://t.co/UAxj4eohlU"
73,"It's incredible to see young women supporting one another as they pursue careers in and around tech. 

What was my advice to this group? You're more powerful than you know. Society may try to make you doubt yourself, but don't believe it for one second. https://t.co/Ef0pKiGJNJ"
74,"Proud to join @EmmanuelMacron and other leaders at the @ParisPeaceForum today.

The pandemic is making inequality worse, but we can reverse this trend by expanding access to economic opportunities everywhere.

Let's choose a more inclusive path to recovery. #ParisPeaceForum2021 https://t.co/zW0OG2W53H"
75,"As we strive to recover from the pandemic, we must center our efforts and innovations on the world's most vulnerable people--or risk losing a generation of progress.

Today at #GrandChallenges, I discussed what an inclusive recovery will take.  https://t.co/XYSIFSGF5L"
76,"Fighting for caregivers is nothing new to former First Lady Rosalynn Carter, and as always, her call to activism is spot-on.

We must invest in institutions that support those on the front lines of care. https://t.co/YNMOYB62wc"
77,RT @gatesfoundation: Great ideas can come from anywhere. #GrandChallenges is about empowering innovators and scientists everywhere to solve…
78,"@AASCU @gatesfoundation @PMethvin Thank you, @PresMillieG and @AASCU, for working to ensure higher ed is more equitable for students. The @gatesfoundation is proud to be writing the next chapter of higher education with you."
79,"As the number of older adults in the U.S. continues to rise, it’s time to unleash innovation in caregiving. 

The 2021 @Techstars Future of Longevity Accelerator class is doing just that. I can’t wait to see the progress they make for older adults and their caregivers. https://t.co/jvXErLgy9p"
80,"In her new memoir, “My Life in Full,” @IndraNooyi shares the unique turns of her trailblazing career and a universal vision for why improving our care infrastructure would make everyone better off. A definite must read! https://t.co/Rker0Wi6Fw"
81,"There is a serious syringe shortage facing low- and middle-income countries, which means vaccines can’t reach vulnerable populations.

I'm excited to see this investment in the production of syringes in Kenya, which will help address the gap.

https://t.co/q8BVeQcdoc"
82,"I am grateful for the advocates and lawmakers who keep on fighting to pass #PaidLeave as part of the #BuildBackBetter plan. Your stories and your voices matter. Thanks to you, we are closer than ever to making history and passing the country’s first national paid leave policy. https://t.co/QMD1jgBpjT"
83,"Smallholder farming is a proven path out of poverty, especially for women, who comprise the majority of smallholder farmers. But climate change is already impacting their work.

We can help small-scale food producers adapt. Here's how. #COP26 https://t.co/xFOwXe5PiI"
84,"I heard '90s fashion is coming back. 🎃

Happy Halloween, everyone! https://t.co/R8tixhSmjt"
85,It’s not too late for lawmakers to include paid leave in the budget package. I urge Congress and the administration to find a way to invest in a better future by passing a national paid leave plan now. 5/5
86,Paid leave is one of few public policies with broad bipartisan support—because we will all need to provide or receive care someday. This is our opportunity to fix a flaw in our system that has held our country back for decades. We can’t waste it. 4/5
87,"The pandemic revealed with brutal clarity how the lack of paid leave hurts women, families, and the economy. It is unconscionable that we would continue to force workers to choose between their health, caring for their loved ones, and their paychecks. 3/5"
88,"But I’m disappointed that #PaidLeave, an essential piece of the caregiving puzzle, was left on the cutting room floor. 2/5"
89,"Today, the White House announced a historic commitment to U.S. families by investing in child care, home care, the Child Tax Credit, and universal pre-k. To the leaders and advocates whose strength and determination made this moment possible: thank you. 1/5"
90,"This welcome step by @Merck will help ensure a promising COVID-19 treatment is both widely available and affordable for lower-income countries.

An effective response to COVID-19 must be an equitable one.  https://t.co/pPGfB8tYco"
91,"COVID-19 exposed the barriers that make women more economically vulnerable in crises like pandemics.

At #HerPower2021, I was honored to join a conversation with @ReenaNinan and @SongweVera about making sure the global recovery lifts up women and girls. https://t.co/YQNPthTcgX"
92,"Congress must #SavePaidLeave—families and businesses are counting on policymakers to act.

Learn why in @TIME. https://t.co/YpIXaoCmb5"
93,"When you’re caring for a loved one who is fighting for their life, the last thing you need to worry about is losing your job. 

It's time for Congress to end these impossible choices and pass #PaidLeave. https://t.co/sqU1hbBjgz"
94,"RT @MomsRising: Yes, we are still fighting for paid family/medical leave to stay in the package as @POTUS promised last week! Thank you, @S…"
95,"RT @PaidLeaveUS: Paid leave is a priority for moderates, conservatives, progressives, it is supported by labor and business. It will unite…"
96,One of the @gatesfoundation’s top priorities is to #EndPolio—and women health workers are key to making it happen. #WorldPolioDay https://t.co/VAJFQ4Q5Jl
97,"Such an important milestone and a critical step in the right direction. Gender equity and equality are foundational to the economic strength, security, and overall health of our country and our world. This is how we build back better. 
https://t.co/WuCrZRP4YD"
98,"The stories we tell shape our world. 

With support from my company, Pivotal Ventures, this @womenshistory project will ensure that women's and girls' unique voices and experiences are included in how we tell the COVID-19 story. https://t.co/fjmePVV7nS"
99,"Congrats to @MoHFW_India, @MansukhMandviya, @DrBharatiPPawar, and the people of India on their huge feat of administering 1 billion doses and vaccinating more than 478 million women. And thank you to the frontline workers who made it possible! https://t.co/pt2D4jhfiM"
100,"“In taking care of your child, you take care of your community, and you take care of your country.” An urgent message from Meghan Markle, the Duchess of Sussex, about the importance of passing #PaidLeave. https://t.co/4V17RsyJgi"
101,"To end this pandemic, we must ensure that everyone has access to life-saving treatments, no matter where they live.

This commitment will help expand access to the promising drug molnupiravir, but it’s not the end of the story. We need other donors to act.
https://t.co/9LdGDp5Dhs"
102,What a joy to celebrate the light and love of Jenn and Nayel this past weekend. So grateful we were able to find a way to safely gather for this special day. ❤ https://t.co/Zr1lvooMI0
103,"Colin Powell was a soldier, statesman, and proud son of immigrants, but I knew him best as a global health champion. I admired his leadership in the fight against HIV/AIDS and his belief that a brighter future for our country depends on a brighter future for the world."
104,"Amazing! Tell Congress that #CareIsEssential, and help make lasting change for care workers. 
https://t.co/se4NKWHg7d"
105,.@WHO's recommendation of the first malaria vaccine for children in Africa brings us one step closer to a malaria-free world. I'm inspired by the scientists and partners who have dedicated their lives to #endmalaria—starting in 1965 with immunologist Ruth Nussenzweig. https://t.co/BqDyTf3LZp
106,"RT @PaidLeaveUS: From families to businesses, our message to Congress is loud and clear: this is the moment for #paidleave. https://t.co/bU…"
107,We need donor countries to step up and drive resources to the greatest needs. Recovery is only inevitable if we make it inclusive. 4/4
108,"This means putting women at the center and investing in caregiving, affordable childcare, and financial inclusion. It means providing quality education and nutritious food. It means strengthening healthcare systems and making sure everyone has access to a vaccine. 3/4"
109,"As the @WorldBank convenes its annual meetings this week, one message must ring out loud and clear: We need to support an economic recovery that works for everyone. 2/4"
110,"COVID-19 pushed 31 million people into extreme poverty, and we’re seeing record levels of inequality. While wealthier nations are starting to recover, others lack the resources they need to bounce back. 1/4"
111,"RT @vowforgirls: Endless possibility for girls means ending child marriage. On International #DayOfTheGirl, let's ✋ #StopTheClock on child…"
112,"This little girl had big dreams and ticked through goals like a to-do list. So when she experienced her first failure, it rocked her confidence.

#ThisLittleGirlIsMe

I wish I could tell her to embrace her shortcomings rather than hide them—they help you become your best self. https://t.co/AntudnLQBH"
113,"#PaidLeave is good for women, families, and the economy. 

Business leaders get it. It's time Congress does too. https://t.co/eE3DwyZA0F"
